{
  "$schema": "./profile.schema.json",
  "appid": "450390",
  "key": "thelab",
  "name": "The Lab",
  "launcher": "game",
  "engine": "vxrt",
  "default_scenario": "title",
  "tune": {
    "scenario": "title"
  },
  "scenarios": {
    "title": {
      "args": [],
      "seconds": 150,
      "note": "the title scene (Start pedestal)"
    }
  },
  "status": {
    "state": "partial",
    "summary": {
      "ja": "VR で動作（タイトル場面 54.1 fps）。プレイテスト待ち",
      "en": "Runs in VR (title scene, 54.1 fps); playtest pending"
    },
    "checked": "2026-10-15",
    "machine": "Apple M1 Max, 32-core GPU",
    "level": "controls"
  },
  "baselines": {
    "title": {
      "min_fps": 50,
      "non_black": true,
      "connected": true,
      "source": "2026-10-14, title scene 56.3 fps (run 20261014T063812Z)"
    }
  },
  "known_issues": [
    {
      "summary": "Hull and domain shaders are not translated (Unity goes on without them)",
      "since": "2026-10-14"
    },
    {
      "summary": "Not played past the title scene yet",
      "since": "2026-10-14"
    }
  ],
  "notes": [
    "2026-10-15: level controls (20261015T011747Z-thelab-title, VXRT_NO_WINE=1); playable needs a playtest (tools/vxrt_playtest.py 450390)."
  ]
}
