{
  "$schema": "./profile.schema.json",
  "appid": "348250",
  "key": "earth",
  "name": "Google Earth VR",
  "launcher": "game",
  "engine": "vxrt",
  "default_scenario": "start",
  "tune": {
    "scenario": "start"
  },
  "scenarios": {
    "start": {
      "args": [],
      "seconds": 150,
      "note": "the starting globe/terrain"
    }
  },
  "status": {
    "state": "partial",
    "summary": {
      "ja": "VR で動作（地形とラベル、56.7 fps）。プレイテスト待ち",
      "en": "Runs in VR (terrain and labels, 56.7 fps); playtest pending"
    },
    "checked": "2026-10-15",
    "machine": "Apple M1 Max, 32-core GPU",
    "level": "controls"
  },
  "baselines": {
    "start": {
      "min_fps": 50,
      "non_black": true,
      "connected": true,
      "source": "2026-10-13, terrain in both eyes, ~59 fps captured"
    }
  },
  "known_issues": [
    {
      "summary": "3k: 42-49 fps; the default quality is smoother",
      "since": "2026-10-14"
    }
  ],
  "notes": [
    "OpenGL (to macOS's OpenGL); needs network access for map tiles.",
    "2026-10-15: level controls (20261015T011513Z-earth-start, VXRT_NO_WINE=1); playable needs a playtest (tools/vxrt_playtest.py 348250)."
  ]
}
